<?xml version="1.0" encoding="UTF-8"?>
<p:LearningStandardDocument
	xmlns:p="https://www.vroodl.es/datamodel/1.x"
	xmlns:xsi="http://www.w3.org/2001/XMLSchema-instance"
	xsi:schemaLocation="https://www.vroodl.es/datamodel/1.x ../schema/LearningStandardDocument.xsd ">
	<p:RefId>ae4990cd6db34ab8a4f5ebed475823f8</p:RefId>
	<p:RefURI></p:RefURI>
	<p:LocalAdoptionDate>2019-08-15</p:LocalAdoptionDate>
	<p:EndOfLifeDate>2019-08-15</p:EndOfLifeDate>
	<p:Description>Lehrplan 2000 der HS/NMS und AHS-Unterstufe</p:Description>
	<p:YearCreated>2000</p:YearCreated>
	<p:Source></p:Source>
	<p:Copyright>
		<p:Holder>Matthias Treitler</p:Holder>
		<p:Date>2019-08-15</p:Date>
	</p:Copyright>
	<p:DocumentDate>2019-08-15</p:DocumentDate>
	<p:DocumentStatus>ready</p:DocumentStatus>
	<p:OrganizationContactPoint></p:OrganizationContactPoint>
	<p:Title>Geographie und Wirtschaftskunde</p:Title>
	<p:GradeLevels>
		<p:GradeLevel>
			<p:Code>1</p:Code>
		</p:GradeLevel>
		<p:GradeLevel>
			<p:Code>2</p:Code>
		</p:GradeLevel>
		<p:GradeLevel>
			<p:Code>3</p:Code>
		</p:GradeLevel>
		<p:GradeLevel>
			<p:Code>4</p:Code>
		</p:GradeLevel>
	</p:GradeLevels>
	<p:CurriculumStructures>
		<p:CurriculumStructure>
			<p:RefId>124db9cb0c004563922b61e15f519bd8</p:RefId>
			<p:Titles>
				<p:Title>Ein Blick auf die Erde</p:Title>
			</p:Titles>
			<p:LearningObjectives>
				<p:LearningObjective>Erwerben grundlegender Informationen über die Erde mit Globus, Karten, Atlas und Bildern.</p:LearningObjective>
			</p:LearningObjectives>
			<p:CurriculumHierarchyLevel>
				<p:Number>1</p:Number></p:CurriculumHierarchyLevel>
			<p:GradeLevel>
				<p:Code>1</p:Code>
			</p:GradeLevel>
		</p:CurriculumStructure>
		<p:CurriculumStructure>
			<p:RefId>60c53b8891024c7ca7c7c8a054a5d880</p:RefId>
			<p:Titles>
				<p:Title>Wie Menschen in unterschiedlichen Gebieten der Erde leben und
					wirtschaften</p:Title>
			</p:Titles>
			<p:LearningObjectives>
				<p:LearningObjective>Erkennen, dass sich Menschen in ihren Lebens- und Konsumgewohnheiten auf regionale und kulturelle Voraussetzungen einstellen und dass die Lebensweise einem Wandel unterliegt.</p:LearningObjective>
				<p:LearningObjective>Erkennen, wie einfache Wirtschaftsformen von Natur- und Gesellschaftsbedingungen beeinflusst werden, und erfassen, dass Menschen unterschiedliche, sich verändernde Techniken und Produktionsweisen anwenden.</p:LearningObjective>
				<p:LearningObjective>Erkennen, wie Menschen mit Naturgefahren umgehen.</p:LearningObjective>
			</p:LearningObjectives>
			<p:CurriculumHierarchyLevel>
				<p:Number>2</p:Number></p:CurriculumHierarchyLevel>
			<p:GradeLevel>
				<p:Code>1</p:Code>
			</p:GradeLevel>
		</p:CurriculumStructure>
		<p:CurriculumStructure>
			<p:RefId>729e89ec9ced4d1c9ed3d0cc1f7cccb3</p:RefId>
			<p:Titles>
				<p:Title>Wie Menschen Rohstoffe und Energie gewinnen und nutzen</p:Title>
			</p:Titles>
			<p:LearningObjectives>
				<p:LearningObjective>Erkennen, wie Rohstoffe und Nutzenergie gewonnen und zu den Verbraucherinnen und Verbrauchern gebracht werden.</p:LearningObjective>
				<p:LearningObjective>Einsehen, dass Rohstoffe und Energieträger auf der Erde ungleichmäßig verteilt und begrenzt vorhanden sind und dass ihre Nutzung oft die Umwelt belastet.</p:LearningObjective>
			</p:LearningObjectives>
			<p:CurriculumHierarchyLevel>
				<p:Number>3</p:Number></p:CurriculumHierarchyLevel>
			<p:GradeLevel>
				<p:Code>1</p:Code>
			</p:GradeLevel>
		</p:CurriculumStructure>
		<p:CurriculumStructure>
			<p:RefId>965910087b564602b006d869288746dc</p:RefId>
			<p:Titles>
				<p:Title>Ein erster Überblick</p:Title></p:Titles>
			<p:LearningObjectives>
				<p:LearningObjective>Regionale bzw. zonale Einordnung der im Unterricht durchgenommenen Beispiele.</p:LearningObjective>
				<p:LearningObjective>Erkennen der Grundstrukturen einfacher Wirtschaftsformen: von der agrarisch dominierten Selbstversorgerwirtschaft zu arbeitsteiligen Systemen.

</p:LearningObjective>
				<p:LearningObjective>Erfassen, dass es auf der Erde eine Regelhaftigkeit in der Anordnung klimatischer Erscheinungen gibt.</p:LearningObjective></p:LearningObjectives>
			<p:CurriculumHierarchyLevel>
				<p:Number>4</p:Number></p:CurriculumHierarchyLevel>
			<p:GradeLevel>
				<p:Code>1</p:Code>
			</p:GradeLevel>
		</p:CurriculumStructure>
	</p:CurriculumStructures>
	<p:Reference>
		<p:MIMEType>HTML</p:MIMEType>
		<p:Description></p:Description>
		<p:URL>https://www.ris.bka.gv.at/GeltendeFassung.wxe?Abfrage=Bundesnormen&Gesetzesnummer=10008568</p:URL>
	</p:Reference>
	<p:DocumentVersion>1</p:DocumentVersion>
</p:LearningStandardDocument>
